{
  "schema_version": "test-003-fuzz-evidence-v1",
  "campaign_id": "test-003-scaffold-static-only",
  "profile_id": "jmeter-5.6.3",
  "target": "all",
  "runner": {
    "nightly": "not-run",
    "cargo_fuzz": "not-run",
    "libfuzzer_sys": "0.4.13",
    "flags": []
  },
  "invariants": [
    {"invariant_id": "JMX-LIMIT-001", "target": "jmx_xml", "status": "planned"},
    {"invariant_id": "JMX-SOURCE-RETAIN-001", "target": "jmx_xml", "status": "planned"},
    {"invariant_id": "JMX-OPAQUE-INVENTORY-001", "target": "jmx_xml", "status": "planned"},
    {"invariant_id": "JMX-DROPPED-INVENTORY-001", "target": "jmx_xml", "status": "planned"},
    {"invariant_id": "JTL-CSV-LIMIT-001", "target": "jtl_csv", "status": "planned"},
    {"invariant_id": "JTL-CSV-PROJECTION-001", "target": "jtl_csv", "status": "planned"},
    {"invariant_id": "JTL-CSV-UNKNOWN-HEADER-001", "target": "jtl_csv", "status": "planned"},
    {"invariant_id": "JTL-XML-LIMIT-001", "target": "jtl_xml", "status": "planned"},
    {"invariant_id": "JTL-XML-PROJECTION-001", "target": "jtl_xml", "status": "planned"},
    {"invariant_id": "JTL-XML-WIRE-001", "target": "jtl_xml", "status": "planned", "coverage_ids": ["JTL-XML-WIRE-PROBE-001"]},
    {"invariant_id": "TEST-003-JTL-MODEL-001", "target": "jtl_model", "status": "planned"},
    {"invariant_id": "TEST-003-JTL-MODEL-002", "target": "jtl_model", "status": "planned"},
    {"invariant_id": "TEST-003-JTL-MODEL-003", "target": "jtl_model", "status": "planned"},
    {"invariant_id": "TEST-003-JTL-MODEL-LIMIT-001", "target": "jtl_model", "status": "planned"},
    {"invariant_id": "EXPR-UNDEFINED-001", "target": "expr", "status": "planned"},
    {"invariant_id": "EXPR-LIMITS-001", "target": "expr", "status": "planned"},
    {"invariant_id": "EXPR-PROGRESS-001", "target": "expr", "status": "planned"},
    {"invariant_id": "BRIDGE-LIMIT-001", "target": "bridge", "status": "planned"},
    {"invariant_id": "BRIDGE-FRAME-ROUNDTRIP-001", "target": "bridge", "status": "planned"},
    {"invariant_id": "BRIDGE-METADATA-001", "target": "bridge", "status": "planned"},
    {"invariant_id": "BRIDGE-RMI-CODEC-001", "target": "bridge_rmi", "status": "planned"},
    {"invariant_id": "BRIDGE-RMI-STATE-001", "target": "bridge_rmi", "status": "planned"},
    {"invariant_id": "BRIDGE-RMI-BACKPRESSURE-001", "target": "bridge_rmi", "status": "planned"},
    {"invariant_id": "BRIDGE-RMI-LIMIT-001", "target": "bridge_rmi", "status": "planned"},
    {"invariant_id": "CONFIG-UNKNOWN-IGNORED-001", "target": "property_config", "status": "planned"},
    {"invariant_id": "CONFIG-DUPLICATE-001", "target": "property_config", "status": "planned"},
    {"invariant_id": "CONFIG-BOUNDS-001", "target": "property_config", "status": "planned"},
    {"invariant_id": "SAVE-CONFIG-MODEL-001", "target": "save_config", "status": "planned"},
    {"invariant_id": "SAVE-CONFIG-PRECEDENCE-001", "target": "save_config", "status": "planned"},
    {"invariant_id": "SAVE-CONFIG-UNKNOWN-001", "target": "save_config", "status": "planned"},
    {"invariant_id": "SAVE-CONFIG-CANONICAL-001", "target": "save_config", "status": "planned"},
    {"invariant_id": "HTTP-URL-BOUNDS-001", "target": "http_policy", "status": "planned"},
    {"invariant_id": "HTTP-HEADER-BOUNDS-001", "target": "http_policy", "status": "planned"},
    {"invariant_id": "HTTP-COOKIE-BOUNDS-001", "target": "http_policy", "status": "planned"},
    {"invariant_id": "PLUGIN-JSON-PREFLIGHT-001", "target": "plugin_json", "status": "planned", "coverage_ids": ["PLUG-003"]},
    {"invariant_id": "REMOTE-CODEC-ROUNDTRIP-001", "target": "remote", "status": "planned"},
    {"invariant_id": "REMOTE-STATE-001", "target": "remote", "status": "planned"},
    {"invariant_id": "REMOTE-BOUNDS-001", "target": "remote", "status": "planned"},
    {"invariant_id": "RUNTIME-CONTROLLER-001", "target": "runtime", "status": "planned"},
    {"invariant_id": "RUNTIME-SCHEDULER-001", "target": "runtime", "status": "planned"},
    {"invariant_id": "RUNTIME-BOUNDS-001", "target": "runtime", "status": "planned"}
  ],
  "outcome": {
    "status": "not_run",
    "artifacts": [],
    "notes": "Static scaffold descriptor only; no cargo-fuzz runner, subprocess, Java, or network execution was performed."
  },
  "corpus": {
    "provenance_file": "corpus/PROVENANCE.md",
    "seed_files": [
      "corpus/jmx_xml",
      "corpus/jtl_csv",
      "corpus/jtl_xml",
      "corpus/expr",
      "corpus/bridge",
      "corpus/bridge_rmi",
      "corpus/property_config",
      "corpus/save_config"
    ],
    "sha256_manifest": "not-generated-static-only"
  }
}
